{
  "move_id": "agon.move.trace.probe_trace",
  "name": "probe_trace",
  "move_class": "trace",
  "intent": "Inspect whether an action or claim has a continuous reviewable trace.",
  "allowed_actor_forms": [
    "agonic_contestant_candidate",
    "agonic_witness_candidate",
    "assistant_service_actor"
  ],
  "allowed_seats": [
    "contestant",
    "witness",
    "service_actor"
  ],
  "preconditions": [
    "action, artifact, or closure candidate exists",
    "trace gap suspicion is named"
  ],
  "must_not": [
    "invent missing trace",
    "treat absence of trace as final moral judgment",
    "store durable scar"
  ],
  "produces": [
    "trace_question"
  ],
  "future_owner_handoffs": {
    "aoa-techniques": [
      "trace reconstruction practice"
    ],
    "aoa-skills": [
      "trace probe workflow"
    ],
    "aoa-evals": [
      "trace integrity proof"
    ]
  },
  "status": "seeded_pre_protocol",
  "wave": "III",
  "live_protocol": false,
  "runtime_effect": "none",
  "center_owns": [
    "lawful move vocabulary",
    "move class boundary",
    "pre-protocol legality intent",
    "owner handoff map"
  ],
  "not_owned_here": [
    "execution steps",
    "runtime packet shape",
    "verdict logic",
    "scar storage",
    "retention check",
    "ToS canonization"
  ]
}
